{"aggregate_sha256":"e732df292e19e6b045963b955874b368dd516e9fa0ddc38049ab2e39a655016d","artifacts":[{"byte_count":366,"id_count":null,"path":"schemas/m0/definitions/artifact-envelope.schema.json","sha256":"e98d9902a047e505a4356306613dc20094924fb0e84d34bb6be1cd2881590513"},{"byte_count":805,"id_count":null,"path":"schemas/m0/definitions/fixture-manifest.schema.json","sha256":"1f5a0c333f822be18be5a868d5b29dbb3f56c9eb22bf4d81551c27f5e8ceb00d"},{"byte_count":2427,"id_count":null,"path":"schemas/m0/definitions/gate-manifest.schema.json","sha256":"27bb27176decb8f8dcfc1e26e8e8005444830f4c764ebf31a3f0e281cda9ce78"},{"byte_count":1270,"id_count":null,"path":"schemas/m0/definitions/hash-lock.schema.json","sha256":"d2db087246366bb35e890ba71f46c5de25b6799757c16c982e689181e807ece3"},{"byte_count":1058,"id_count":null,"path":"schemas/m0/definitions/inventory.schema.json","sha256":"bc5a2745d74b8b0d1ea55dec37a001255491f1e886d104e51013d083e38235d0"},{"byte_count":1676,"id_count":null,"path":"schemas/m0/definitions/phase-trace.schema.json","sha256":"ff413c6ac95ddac2f4cc8b65ff26aa79d207a796fe3e8b59244c0ed624630bd0"},{"byte_count":1712,"id_count":null,"path":"schemas/m0/definitions/python-benchmark-result.schema.json","sha256":"7c4ac7d5f9d22334d33cb8c34b7318447dee5bfe8c13e06adee31351cf9cf84e"},{"byte_count":2088,"id_count":null,"path":"schemas/m0/definitions/rebaseline-proposal.schema.json","sha256":"9d91bb1f99bf162d672de1f9007e74a4bf1f4c6e5956dd048cd26ec466547bb3"},{"byte_count":541,"id_count":null,"path":"schemas/m0/definitions/statistical-panels.schema.json","sha256":"8fa68956d86f54ed848b2fb1a379a5e83117329d95f77858f93be71c80a7fdc8"},{"byte_count":676,"id_count":null,"path":"schemas/m0/definitions/tape-bundle.schema.json","sha256":"f7b269b3cf0c62b6db3d0bf7feefcfcfd3165bda3d1e1f0aa301672fd7236d97"},{"byte_count":419,"id_count":null,"path":"schemas/m0/definitions/tolerance-registry.schema.json","sha256":"37df6712b781b8c3d38d6018a8d9d4e38fd037b7d87bd1205025e56d0998562a"},{"byte_count":23157,"id_count":66,"path":"schemas/m0/inventory/capabilities.json","sha256":"74cb5fa3b61adee01de38e375a812263010efaf55f66d020ca15a785edda55f3"},{"byte_count":165647,"id_count":453,"path":"schemas/m0/inventory/config.json","sha256":"81c260b76638d8f6ee538569c3fd8cbd4bb6b57f66d1b265dec4c82ed738ee5d"},{"byte_count":24314,"id_count":45,"path":"schemas/m0/inventory/controller.json","sha256":"b2eea953cee1ba8835c2e9f7ac1123aae045de41e26867fe6a13944e269b6c56"},{"byte_count":3999,"id_count":10,"path":"schemas/m0/inventory/desktop_protocol.json","sha256":"a4264486cbd1039f3f2d00a4f426f0ef5df20d6fb5243523df11066dd1266054"},{"byte_count":8905,"id_count":24,"path":"schemas/m0/inventory/events.json","sha256":"813b09aa01ddf0cc28c74ad1213112731cbffcbec273ffc27dbb78e773595b0d"},{"byte_count":3723,"id_count":13,"path":"schemas/m0/inventory/invariants.json","sha256":"5baddc82d1f47a620107904f765156d9c16741f34ce89c58c9d9f8153c4312cc"},{"byte_count":2397,"id_count":2,"path":"schemas/m0/inventory/m4_v0_v1.json","sha256":"05dc0406b74a2eec836ccdcdb74512388f5ed43be5a24751d92ecf13014c1878"},{"byte_count":277751,"id_count":551,"path":"schemas/m0/inventory/metrics.json","sha256":"8319fade36768d23584009c215f3fe93d41678bbb34f0580019b144b8a8975c3"},{"byte_count":80912,"id_count":266,"path":"schemas/m0/inventory/modules.json","sha256":"b6fd613ff697a44985aa93297e4627b5b713d0194a915a4e37064c7a35744ed6"},{"byte_count":57246,"id_count":144,"path":"schemas/m0/inventory/observations.json","sha256":"49ebeff310895f5f4a8305e1b10029b397c79354f85b48548ebf5e8f8e01b9b5"},{"byte_count":5603,"id_count":16,"path":"schemas/m0/inventory/phases.json","sha256":"efd8b4b5dc1e605736eb08d54a6d83ba78a4c1eaf3f6a7ffb678bb429d5cb6cd"},{"byte_count":88026,"id_count":102,"path":"schemas/m0/inventory/policy.json","sha256":"dcfe3b933cf33b3169c31aef433e18f68bab74f02afd055018ffd4bb3a128f88"},{"byte_count":1835,"id_count":6,"path":"schemas/m0/inventory/probes.json","sha256":"6c6cac1a8bb49918c5b897c06ebb1792e238c9312a2de0f3c9b1d8fc48125c02"},{"byte_count":52971,"id_count":126,"path":"schemas/m0/inventory/rng.json","sha256":"c0d182f19bbaa8deb2108aebd94dbe188b2626047685014ff51e0992bbec371f"},{"byte_count":15392,"id_count":40,"path":"schemas/m0/inventory/scenarios.json","sha256":"9ab345cbb1504be6ac4bf2f515c65de15624ce16d72491448adcfeb14d8ca6ca"},{"byte_count":6284,"id_count":9,"path":"schemas/m0/inventory/shocks.json","sha256":"c1590de1fb855736853c52e8b3a5e01ee6c25dfae20b481095676a4261b565f5"},{"byte_count":2931,"id_count":null,"path":"schemas/m0/manifests/benchmark_scenarios.yaml","sha256":"1f1b14f468dc9948a0e271e4f5f0be8799d6d59722e7221bca76d9d83300b565"},{"byte_count":853,"id_count":null,"path":"schemas/m0/manifests/comparator_cases.yaml","sha256":"26055982ca7218cfe876c83a6e1d62416f1aaf1d48238a922b80e7bb5b944ec5"},{"byte_count":5014,"id_count":null,"path":"schemas/m0/manifests/fixtures.yaml","sha256":"6d6566af6a06e808f1e905c01aa74753ebfeb5d72d23107584ffb293181a2b8e"},{"byte_count":9866,"id_count":null,"path":"schemas/m0/manifests/gates.yaml","sha256":"486dd90cd397af29cab378e838125426717e379f6b89e80ac7b328f89640307c"},{"byte_count":3094,"id_count":null,"path":"schemas/m0/manifests/invariants.yaml","sha256":"891559eaa22f1b98ca786a75ecee7eff18528343ffe5e6d4d7d07e2905f1b202"},{"byte_count":2284,"id_count":null,"path":"schemas/m0/manifests/m4_v0_v1.yaml","sha256":"48f9bb4d3fa984c2ac07abcd323850d17a55a92663131c7ebe4644558fbf5983"},{"byte_count":4946,"id_count":null,"path":"schemas/m0/manifests/phases.yaml","sha256":"860b850b9632b896bf4a2d919ca73ff3ea76688206e19d710c48d3e51e5f7089"},{"byte_count":1432,"id_count":null,"path":"schemas/m0/manifests/probe_disposition.yaml","sha256":"e379f80ba5c9783d6822db343af2892f89e53b597653183caf39ed007921c705"},{"byte_count":3910,"id_count":null,"path":"schemas/m0/manifests/semantic_panels.yaml","sha256":"343b43d53642080d856b45414228f6daf2f37324a59af64535e486985013f8f1"},{"byte_count":2329,"id_count":null,"path":"schemas/m0/manifests/statistical_panels.yaml","sha256":"f1dd2c17bff7c92fc9131c19bb121ec9b7cfd76b08421ed18b96f532971d0fe2"},{"byte_count":5502,"id_count":null,"path":"schemas/m0/manifests/tapes.yaml","sha256":"8f0ac93029bb84944630ce3bfc753da607cfff83439802b7d53a1a99287033bd"},{"byte_count":7749,"id_count":null,"path":"schemas/m0/manifests/tolerances.yaml","sha256":"34bdb5ca3e952b3077d49e097468ac50e76d8ff217dfe51a064570c50054b3fe"}],"generator_version":"m0-inventory-generator-v1","oracle_commit":"c0adcf1f8ea7f69cad28b92e27c9a4509dfdac23","schema_version":"m0-hash-lock-v1"}
